,Article Name,Description,Author(s),Author Type(s),Date,URL
0,"Today’s Wordle #1525 Hints And Answer For Friday, August 22nd","Looking for help with today's New York Times Wordle? Here are some expert hints, clues and commentary to help you solve today's Wordle and sharpen your guessing game.",,,,https://www.forbes.com/sites/erikkain/2025/08/21/todays-wordle-1525-hints-and-answer-for-friday-august-22nd/
1,Ron Howard Talks Challenge Of Finding Distribution For New Film ‘Eden’,"Oscar-winning director Ron Howard discusses how he got his new film ""Eden"" — starring Jude Law, Sydney Sweeney, Vanessa Kirby and Ana de Armas — in theaters.",,,,https://www.forbes.com/sites/timlammers/2025/08/21/ron-howard-talks-challenge-of-finding-distribution-for-new-film-eden/
2,‘Escape From Tarkov’ Release Date Revealed,"The release date for Escape From Tarkov has been revealed, with the game finally set to leave beta in the coming weeks. ",,,,https://www.forbes.com/sites/mikestubbs/2025/08/21/escape-from-tarkov-release-date-revealed/
3,"Guild, Beckham’s Former Esports Team, Folds After 6 Years","Just 13 days short of its iron anniversary, British competitive gaming outfit Guild Esports, once backed by David Beckham, has announced it’s shutting shop.",,,,https://www.forbes.com/sites/mattgardner1/2025/08/21/guild-esports-beckhams-former-team-calls-it-quits-after-6-years/
4,‘Mortal Kombat: Legacy Kollection’ Confirms The Final Two Games,We finally know the full list of all eleven games and all 20 versions of Mortal Kombat included in the upcoming collection.,,,,https://www.forbes.com/sites/davidjagneaux/2025/08/21/mortal-kombat-legacy-kollection-confirms-the-final-two-games/
5,"New Details On Cast, System And More For Critical Role Campaign 4","Critical Role announced more details on their next campaign starting October 2nd, including who is playing and what game system they'll be using.",,,,https://www.forbes.com/sites/robwieland/2025/08/21/new-details-on-cast-system-and-more-for-critical-role-campaign-4/
6,Metal Gear Solid Delta: Snake Eater - Release Date & Everything You Need To Know,"Metal Gear Solid Delta: Snake Eater launches August 28, 2025, with Unreal Engine 5 visuals, new controls, and special editions for hardcore fans.",,,,https://www.forbes.com/sites/brianmazique/2025/08/21/metal-gear-solid-delta-snake-eaterrelease-date--everything-you-need-to-know/
7,Alex Garland’s ‘Warfare’ Gets HBO Max Streaming Date,“Warfare” — a real-time Iraq War tale from “Civil War” writer and director Alex Garland — is coming soon to HBO Max.,,,,https://www.forbes.com/sites/timlammers/2025/08/21/alex-garlands-warfare-gets-hbo-max-streaming-date/
8,What ‘Battlefield 6’ Is Changing After Its Questionable Second Open Beta,"After two Battlefield 6 betas, DICE is talking about what is and what is not being changed in the future for the release of the game.",,,,https://www.forbes.com/sites/paultassi/2025/08/21/what-battlefield-6-is-changing-after-its-questionable-second-open-beta/
9,Watch HBO Max’s New 100% Rotten Tomatoes Show For Free Here,"The best new show to hit HBO Max in a while has arrived with perfect scores from critics, but it may not be for everyone, given its subject matter. Watch it free here.",,,,https://www.forbes.com/sites/paultassi/2025/08/21/watch-hbo-maxs-new-100-rotten-tomatoes-show-for-free-here/
10,"Recap: ‘South Park’ Season 27, Episode 3 - ‘Sickofancy’ And How To Watch","""South Park"" Season 27, Episode 3 — titled Sickofancy — takes on ChatGPT, tech bros, the immigration crackdown and President Donald Trump and Satan (again) at the White House.",,,,https://www.forbes.com/sites/timlammers/2025/08/21/south-park-season-27-episode-3-recap-of-sickofancy-and-how-to-watch/
11,Another Red Flag About ‘Avengers: Doomsday’ Has Popped Up,"Avengers: Doomsday has produced a number of questions that make its filming seem questionable, but now we can add another anecdote to that list.",,,,https://www.forbes.com/sites/paultassi/2025/08/21/another-red-flag-about-avengers-doomsday-has-popped-up/
12,Bad News About ‘Wednesday’ Season 2 Viewership Ahead Of Part 2,"Wednesday season 2 is suffering from a number of issues, and chief among them is its viewership compared to its first season.",,,,https://www.forbes.com/sites/paultassi/2025/08/21/bad-news-about-wednesday-season-2-viewership-ahead-of-part-2/
13,‘Hollow Knight: Silksong’ Has An Imminent Release Date After Six Years,"Hollow Knight: Silksong has a release date after six and a half years, and now it's about to drop imminently. ",,,,https://www.forbes.com/sites/paultassi/2025/08/21/hollow-knight-silksong-has-an-imminent-release-date-after-six-years/
14,‘The Pitt’ Season 2 Gets A Surprise Trailer Ahead Of Its Release Date,"There's a new, very early trailer for The Pitt season 2, but that's because it has a very early release date.",,,,https://www.forbes.com/sites/paultassi/2025/08/21/the-pitt-season-2-gets-a-surprise-trailer-ahead-of-its-release-date/
15,"NYT ‘Connections’ Hints For Friday, August 22: Today’s Clues And Answers",Looking for some help with today's NYT Connections? Some hints and the answers for today's game are right here to help keep your streak alive.,,,,https://www.forbes.com/sites/krisholt/2025/08/21/nyt-connections-today-hints-friday-august-22-clues-answers-803/
16,"NYT Strands Hints For Friday, August 22: Today’s Spangram And Answers (Whodunit?)",Looking for some help with today's NYT Strands? An extra hint and the answers are right here to help you finish the grid and keep your streak intact.,,,,https://www.forbes.com/sites/krisholt/2025/08/21/nyt-strands-hints-today-for-friday-august-22-spangram-answers-whodunit-537/
